{
  "$schema": "./routes.schema.v1.json",
  "schemaVersion": 1,
  "contentVersion": 7,
  "updatedAt": "2026-10-14T09:32:24.260Z",
  "routes": [
    {
      "id": "tue",
      "segments": [
        {
          "id": "tue-1",
          "mode": "walk",
          "placeIds": [
            "hotel-la-scaletta",
            "ponte-vecchio",
            "uffizierna",
            "piazza-della-signoria",
            "orsanmichele",
            "piazza-della-repubblica",
            "duomo-santa-reparata",
            "serre-torrigiani-in-piazzetta",
            "ponte-santa-trinita",
            "hotel-la-scaletta"
          ]
        }
      ]
    },
    {
      "id": "wed",
      "segments": [
        {
          "id": "wed-1",
          "mode": "walk",
          "placeIds": [
            "hotel-la-scaletta",
            "ponte-vecchio",
            "duomo-santa-reparata"
          ]
        },
        {
          "id": "wed-2",
          "mode": "walk",
          "placeIds": [
            "duomo-santa-reparata",
            "ponte-vecchio",
            "hotel-la-scaletta"
          ]
        },
        {
          "id": "wed-3",
          "mode": "walk",
          "placeIds": [
            "hotel-la-scaletta",
            "io-osteria-personale"
          ]
        },
        {
          "id": "wed-4",
          "mode": "walk",
          "placeIds": [
            "io-osteria-personale",
            "hotel-la-scaletta"
          ]
        }
      ]
    },
    {
      "id": "thu",
      "segments": [
        {
          "id": "thu-1",
          "mode": "taxi",
          "placeIds": [
            "hotel-la-scaletta",
            "fondazione-arte-della-seta-lisio"
          ]
        },
        {
          "id": "thu-3",
          "mode": "taxi",
          "placeIds": [
            "fondazione-arte-della-seta-lisio",
            "piazzale-michelangelo"
          ]
        },
        {
          "id": "thu-4",
          "mode": "walk",
          "placeIds": [
            "piazzale-michelangelo",
            "san-miniato-al-monte",
            "giardino-delle-rose"
          ]
        },
        {
          "id": "thu-5",
          "mode": "walk",
          "placeIds": [
            "giardino-delle-rose",
            "hotel-la-scaletta"
          ]
        }
      ]
    },
    {
      "id": "fri",
      "segments": [
        {
          "id": "fri-1",
          "mode": "walk",
          "placeIds": [
            "hotel-la-scaletta",
            "ponte-vecchio",
            "uffizierna",
            "basilica-di-santa-croce",
            "mercato-di-santambrogio",
            "nugolo",
            "hotel-la-scaletta"
          ]
        }
      ]
    },
    {
      "id": "sat",
      "segments": [
        {
          "id": "sat-1",
          "mode": "walk",
          "placeIds": [
            "hotel-la-scaletta",
            "palazzo-pitti",
            "giulio-giannini-e-figlio",
            "piazza-santo-spirito",
            "hotel-la-scaletta"
          ]
        }
      ]
    }
  ]
}
